{
  "$schema": "https://raw.githubusercontent.com/Edvantage26/jig/main/schema/jig.schema.json",
  "version": 1,
  "features": {
    "okf": true,
    "danger": true
  },
  "trunk": "main",
  "verify": [
    "npm test"
  ],
  "knowledge": ".okf",
  "modules": {
    "danger": {
      "ignore_rules": []
    }
  }
}
